10058592166008,性价比较高，看了同配置，这个价格很有竞争力，包装很好，发货速度也比较及时，客服响应比较快！,2022-09-26 20:04:58,5
10058592166008,收货一周，很不错！开机速度快，运行稳定！??,2022-11-13 20:52:55,5
10058592166008,选择了好久，最终选择的，攀升电脑，大品牌值得信赖，强烈推荐给大家购买，性价比超级高，下次会再来的。,2022-11-21 10:48:53,5
10058592166008,"电脑开机很快，几秒钟就开机了，外观不错，办公使用配置好。
外观设计风格非常好看",2022-10-17 11:53:24,5
10058592166008,非常好用，颜值高，速度快，前台用完美,2022-10-02 20:09:40,5
10058592166008,疫情期间居家办公，赶快下单，到的很及时，第二天就到了，包装很好，性价比高,2022-09-13 20:50:26,5
10058592166008,第二天就收到了  用了两天 感觉很满意 还有赠品,2022-10-03 08:18:13,5
10058592166008,质量很好，价格实惠，购物体验好，送货快，满意！！！！！！！,2022-10-22 19:26:37,5
10058592166008,电脑性价比很高，性能配置也不错，推荐购买，店铺客服回复也很及时。,2022-10-02 09:23:01,5
10058592166008,非常好，秒开机，运行流畅！很满意！,2022-11-19 15:29:53,5
10058592166008,朋友推荐的，孩子上网课用，运行很流畅，推荐购买,2022-10-07 14:37:24,5
10058592166008,运行快，高端大气上档次，外观也很不错,2022-11-17 16:12:58,5
10058592166008,买来是办公用的，速度很快，很满意。,2022-10-11 17:28:48,5
10058592166008,发货速度很快，包装也很好价格也合理，客服人很好不错的一次购物,2022-11-28 15:30:25,5
10058592166008,机器和品牌都很过硬，已经买了不下30台了，应该准备点下礼物才行哦。继续支持！,2022-10-27 16:07:58,5
10058592166008,运行流畅，产品很好，主机很好用,2022-10-24 10:46:55,5
10058592166008,头一次购买，真心不错。第1台机子出了一点小问题售后很热心周到的帮忙解决。点赞。,2022-09-26 09:22:20,5
10058592166008,不错价格实惠质量不错，开机速度很快。。。。。。。。。,2022-10-31 15:46:08,5
10058592166008,外观简约，很好用，很流畅。,2022-10-24 11:25:06,5
10058592166008,发货速度很快，外观也不错??服务很好,2022-09-27 19:02:10,5
10058592166008,非常非常非常好的电家，速度快,2022-10-29 08:01:01,5
